{
  "schema_version": "attune.eval.corpus.v1",
  "corpus_id": "generated_thousand_docs",
  "domain": "mixed_enterprise",
  "license": "generated-test-fixture",
  "source": {
    "type": "generated",
    "generator": "scripts/eval/generate-scale-corpus.py",
    "command": "python3 scripts/eval/generate-scale-corpus.py --documents 1000 --domains networking,security,product --out <workspace>"
  },
  "scale": {
    "tier": "T2",
    "documents": 1000,
    "bytes": 3000000,
    "expected_chunks": 10000,
    "ocr_ratio": 0.0,
    "languages": ["zh", "en"]
  },
  "profiles": {
    "scale_thousand": {
      "documents": ["generated:1000"],
      "purpose": "thousand-document mixed enterprise retrieval and support workflow regression"
    }
  },
  "indexing": {
    "parser_modes": ["markdown", "text"],
    "max_pending_seconds": 900,
    "delete_rescan_required": true
  }
}
